<?xml version="1.0" encoding="UTF-8"?>
<jms-provider-config xmlns:xsi="http://www.w3.org/2001/XMLSchema-instance" xsi:noNamespaceSchemaLocation="jmsProviderConfigProject.xsd">
	<jms-providers>
		<jms-provider>
			<name></name>
			<initial-context-factory>com.tibco.tibjms.naming.TibjmsInitialContextFactory</initial-context-factory>
			<provider-url>tcp://shasun3:7223</provider-url>
			<security-principal>arpuser</security-principal>
			<security-credentials>arpuser</security-credentials>
			<connection-factory>
				<local-jndi-name>MessageFrameworkXAPoolCF</local-jndi-name>
				<remote-jndi-name>XAGenericConnectionFactory</remote-jndi-name>
				<username>arpuser</username>
				<password>arpuser</password>
			</connection-factory>
			<connection-factory>
				<local-jndi-name>MessageFrameworkPoolCF</local-jndi-name>
				<remote-jndi-name>GenericConnectionFactory</remote-jndi-name>
				<username>arpuser</username>
				<password>arpuser</password>
			</connection-factory>
		</jms-provider>
		
		<jms-provider>
			<name>CLIENTPUSH</name>
			<initial-context-factory>com.tibco.tibjms.naming.TibjmsInitialContextFactory</initial-context-factory>
			<provider-url>tcp://cdremsint1:7554,tcp://cdremsint2:7554</provider-url>
			<security-principal>fwk_cpfw</security-principal>
			<security-credentials>fwk_cpfw</security-credentials>
			<connection-factory>
				<local-jndi-name>MessageFrameworkXAPoolCF</local-jndi-name>
				<remote-jndi-name>XAGenericConnectionFactory</remote-jndi-name>
				<username>fwk_cpfw</username>
				<password>fwk_cpfw</password>
			</connection-factory>
			<connection-factory>
				<local-jndi-name>MessageFrameworkPoolCF</local-jndi-name>
				<remote-jndi-name>GenericConnectionFactory</remote-jndi-name>
				<username>fwk_cpfw</username>
				<password>fwk_cpfw</password>
			</connection-factory>
		</jms-provider>
		
		<jms-provider>
			<name>FODE</name>
			<initial-context-factory>com.tibco.tibjms.naming.TibjmsInitialContextFactory</initial-context-factory>
			<provider-url>tcp://choica3-vista:7222</provider-url>
			<security-principal>fwk_fode</security-principal>
			<security-credentials>fwk_fode</security-credentials>
			<connection-factory>
				<local-jndi-name>MessageFrameworkXAPoolCF</local-jndi-name>
				<remote-jndi-name>XAGenericConnectionFactory</remote-jndi-name>
				<username>fwk_fode</username>
				<password>fwk_fode</password>
			</connection-factory>
			<connection-factory>
				<local-jndi-name>MessageFrameworkPoolCF</local-jndi-name>
				<remote-jndi-name>GenericConnectionFactory</remote-jndi-name>
				<username>fwk_fode</username>
				<password>fwk_fode</password>
			</connection-factory>
		</jms-provider>
		
	</jms-providers>
	<connection-pool>
		<max-active>300</max-active>
		<max-wait>600000</max-wait>
		<max-idle></max-idle>
		<max-total></max-total>
		<min-idle></min-idle>
		<clean-interval></clean-interval>
		<idle-time></idle-time>
	</connection-pool>
</jms-provider-config>
